1, USER_MENTION rachels losing it thats a very good sign rachel senses dans pandemic plan is working that signals shes running
1, USER_MENTION if you want to be in a chris brown music video as a child did you really live URL
1, USER_MENTION thatcher lost it completely at the end major had some really bad times blair and brown too but nothing nothing
1, USER_MENTION otd britain exits the erm on john smith claims that john major is devalued prime
1, USER_MENTION put your life in the hands of a rock n roll band first ian brown now noel gallagher we need
1, USER_MENTION frame white and purple also available price n700 frame frame leather brown also available
1, USER_MENTION wizkid has a song with drake chris brown future r kelly calvin harris vybz kartel tyga french montana mhd akon
1, USER_MENTION looking to see if a.j brown is still on the titans roster URL
1, USER_MENTION with a dog is a small portion of j.j.brown URL
1, USER_MENTION ladies gentlemen senator gabriela j morris a win for the youth of jamaica USER_MENTION URL
1, USER_MENTION this isnt portland kathryn j patterson a sorority sister blm activist at the private USER_MENTION was arrested
1, USER_MENTION two online political polls about lockdown are hit by a surge of fake votes leading nine to takedown the
1, USER_MENTION USER_MENTION chris kenny totally misleads the sky news viewers over poll then refuses to apologize when nine
1, USER_MENTION more depressing than the president of the united states saying we need more retribution from police in response to
1, USER_MENTION week target leaders wr d adams d hopkins a cooper j crowder r gage j jones c
1, USER_MENTION we need me j cole drake kendrick all in a room time to get free we will not argue amongst each other
1, USER_MENTION suspicious brown said wildfires represent a onceinageneration event then telling people get out now can they
1, USER_MENTION this is an excellent way to kick off a discussion he is so good URL
1, USER_MENTION its ok to be concerned with trent browns availability but its not ok to bash him before knowing anything lets just
1, USER_MENTION old enough to remember when a.j brown was the titans wr you wanted
1, USER_MENTION grab your snoopy pencil box pack a brown bagged lunch fake a doctors note and tune in for a totally awesome night
1, USER_MENTION USER_MENTION scott youre a beautiful man we all love you whos with me please dont apologize you have done more
1, USER_MENTION only two years ago central park removed a statue of j marion sims a white man who made a name for himself by
1, USER_MENTION a florida judge today ordered freeagent wr antonio brown to turn over within days text messages and other evidence
1, USER_MENTION les ont cet si on met la dans le sable on va pas trump va commencer
1, USER_MENTION on this day last year antonio brown caught a td pass from tom brady he hasnt played in an nfl game since
1, USER_MENTION what we need is a more gender inclusive mass sterilization of brown people
1, USER_MENTION music gives us the one thing that very few other things bring us and that is a reminder that we are not alone
1, USER_MENTION this autumn arches national park is sporting hues of coffee brown and light amber with highlights of turquoise this
1, USER_MENTION USER_MENTION USER_MENTION a former ohioan lifetime buckeye fan a huge supporter of sherrod brown so thrilled
1, USER_MENTION my papa is missing a lil older not really tech savvy i currently do not have a picture of him so i know you guys
1, USER_MENTION tight end u had a big opening nfl weekend USER_MENTION catches for yards and td USER_MENTION catches for
1, USER_MENTION this man nelly years and hit a whole back flip in lmao this man is enjoying himself right
1, USER_MENTION the movement is about controlling white reproduction it is a white supremacist project why
1, USER_MENTION vulnerability is hard it feels scary dangerous but not as hard scary or dangerous as getting to the end of
1, USER_MENTION USER_MENTION frontal attack on brown ppl ice proposed regulations to request immigrant dna a court
1, USER_MENTION a.j brown managers URL
1, USER_MENTION playing with a purpose URL
1, USER_MENTION we all guessed this gas annoucenment was coming when they put the gas people in charge of the country during the largest
1, USER_MENTION drs on the world today abc radio babies born in albury after the australian bushfires are underweight the placentas of
1, USER_MENTION any reason you left out the fact a liberal party member running for preselection and her lawyer advises the
1, USER_MENTION if youre a political journalist and your reaction to the government promising yet more taxpayer handouts to its large
1, USER_MENTION so today the federal government announced a gasled recovery against the advice of pretty much every expert in the
1, USER_MENTION in some celtics fans booed at the draft party because they thought someone like jimmy butler could help
1, USER_MENTION daniel andrews have a different view to me but leave my family out of it particularly the dead members of my family
1, USER_MENTION jte drague tu screen et tu le montre ma meuf esh cest quelle briseuse de couple
1, USER_MENTION nfl is losing fans faster than kamala harris went down on married willie brown for a job
1, week target leaders wr d adams d hopkins a cooper j crowder r gage j jones c ridley w fuller j brown o beckham q cephus fantasyfootball fantasyfootballadvice
1, USER_MENTION josh allen has a miscue to j.brown in the end zone meanwhile the two teams who selected before the bills in are
1, USER_MENTION comment mort il lui a pas le choix
1, USER_MENTION bristol bridge c.1849 from a redcliffe street window georgian bridge built in and tollbooths seen removed
1, USER_MENTION alvaro gonzalez quand jai le avec lespanyol dans un match chaud jai dit messi tu es vraiment
1, USER_MENTION jonnu smith is the teversion of derrick henry a.j brown is the wrversion of derrick henry jadeveon clowney is
1, USER_MENTION does a.j brown still play for the titans asking for a friend
1, maybe the titans can use a.j brown to kick field goals in the second half URL
1, we found a.j brown URL
1, does a.j brown still play for the titans asking for a friend
1, a.j brown managers URL
1, old enough to remember when a.j brown was the titans wr you wanted
1, looking to see if a.j brown is still on the titans roster URL
1, sure its too early to say but a.j brown terry mclaurin deebo samuel d.k metcalf darius slayton diontae johnson marquise brown and mecole hardman all look better than patriots firstrounder nkeal harry
1, USER_MENTION reupping this story today relevant as ever california agency took nine years to create map of highfirethreat
1, USER_MENTION one of these is the target chart for patrick mahomes and the other is josh allen one is being praised for picking apart a
1, USER_MENTION in sessions through the cdc claims that racism is a public health crisis and that systemic racism leads to
1, USER_MENTION USER_MENTION has never picked a bigger battle than this one going to lose a lot of skin
1, USER_MENTION leigh sales on a mission to destroy state labor governments i reckon she should go to sky abc730
1, USER_MENTION how ridiculous agl closed uneconomic liddell power station stating that the mw would be replaced turnbull wanted
1, USER_MENTION george szabo head of the liberal party roseville branch blocked me before i could ask him about his push to flip the age
1, USER_MENTION i dont care how bad i want it im never gonna cross anyone in my circle to get it
1, USER_MENTION who started calling you playoff URL
1, USER_MENTION zealand pm jacinda ardern has promised to achieve renewable energy by if her party wins reelection in
1, USER_MENTION im a working class mother of running for congress i already won my primary i support medicare for all
1, USER_MENTION join us on sept to call on USER_MENTION to kickstart a programme of public green job creation young people will
1, USER_MENTION the green party is getting assistance from republicans claim the democrats who featured republicans at their
1, USER_MENTION as the world moves away from fossil fuels heres a look at the dark side of green energy watch the full doc
1, USER_MENTION this past offseason our USER_MENTION tried to sign jamychal green he chose the clippers they had an agreement with morris
1, USER_MENTION lebron it like to blow a lebron URL
1, USER_MENTION astounding that after a massive family separation operation mass sexual assault of detainees trapping immigrants in
1, USER_MENTION peeing after sex be like URL
1, USER_MENTION hardly even worth getting angry at these videos theyre not aimed at nonvoters or third party voters theyre aimed
1, USER_MENTION exclusive videos obtained by patch show the moment two USER_MENTION police officers handcuffed detained and searched a queens
1, USER_MENTION states are filing lawsuits to keep the green party off the ballot still think you live in a democracy
1, USER_MENTION if youre a canadian voter who wants to see a big green infrastructure announcement please retweet so USER_MENTION
1, USER_MENTION this man nelly years and hit a whole back flip in lmao this man is enjoying himself right
1, USER_MENTION imagine you toss a match on a pile of green wood now imagine you toss the same match on a pile of dry tinder what
1, USER_MENTION only two years ago central park removed a statue of j marion sims a white man who made a name for himself by
1, USER_MENTION vote for us is a vote for the democratic party shouts as they sue pennsylvania and texas to kick the green
1, USER_MENTION i know know i had a bad weekend so liven things up with some animalfacts about the green anaconda i
1, USER_MENTION reports plan to have snowy hydro build a gas generator in the hunter valley
1, USER_MENTION old price for insulin a month new price of insulin a month thank you USER_MENTION
1, USER_MENTION fake grass is always green i appreciate the old head who told me that
1, USER_MENTION omgawd waving to a empty field URL
1, USER_MENTION a republican member of the wisconsin elections commission advised the green party about who to hire as an attorney after its
1, USER_MENTION a.j green on joe burrows poise late its unbelivable that guy dont flinch the way he handled himself on that last
1, USER_MENTION breaking in decision wisconsin supreme court keeps the green party ticket off of wisconsins ballot
1, USER_MENTION another nike dunk low has surfaced this time draped in i got a feeling these are for the
1, USER_MENTION some people are naturally nice no matter what it is not flirting not a green light it is just the way they are
1, USER_MENTION woke green campaigner lewis hamilton lives it up on philip greens yacht the quicker we stop listening to
1, joe burrow on playing with a.j green i think its going to be a great connection the next few years greens franchise tag expires at the end of this season
1, USER_MENTION friendly reminder that wife savannah is fine as hell URL
1, USER_MENTION this anecdote about bono trying to flesh out green song for spiderman turn off the dark is some of the
1, USER_MENTION ago i dm my crush telling her im gonna take her out on a date yesterday i asked her to marry me she said no
1, USER_MENTION calls for tyson furys wife paris to become a permanent member of loose women URL
1, USER_MENTION everyone talking about how a cool animation when you press like button on appleevent but do you know that
1, USER_MENTION a.j green saw a lot in joe leading that last drive just had a bad call he didnt play like a rookie or act like a
1, USER_MENTION the west coast is on fire the color of the sky turned red the air in many parts of the u.s is dangerous to breathe
1, USER_MENTION three liberal judges just joined with a conservative judge to remove the green party ticket off ballot but
1, USER_MENTION the context for still and know that i am is not green pastures with a cool breeze chaos warfare and
1, USER_MENTION of nyc criminal cases get dismissed USER_MENTION suspended the requirement that they be dismissed only
1, d.j moore allen robinson odell beckham t.y hilton a.j green diontae johnson mike williams all had at least targets fewer than ppr points expect to be higher on all of them than the consensus in week
1, USER_MENTION you feel me URL
1, USER_MENTION pardon me while i elevate
1, USER_MENTION URL URL
1, USER_MENTION a.j green on offensive pass interference called on him for one he was clamping me the whole time coming off the
1, USER_MENTION a goddess in green URL
1, USER_MENTION a couple months ago trump ended temporary protected status for hundreds of thousands of illegal immigrants today the
1, USER_MENTION at national market
1, USER_MENTION
1, USER_MENTION URL
1, USER_MENTION video an experimental green housing project in chinas southwestern chengdu city has been overrun by its own plants with state
1, USER_MENTION hallelujah best news of the day by a mile absentee ballots in wisconsin can be mailed as scheduled now plus
1, USER_MENTION such a mistake such a betrayal such a sellout such a tragedy pope gives green light for extension of accord with
1, USER_MENTION i remember being a green lil commentator when western nations were first legalizing homosexual i warned of a
1, USER_MENTION who gives a single fuck
1, USER_MENTION breaking circuit has given the trump administration a green light to proceed with deportation of about el
1, USER_MENTION big rookie treasure has turned on the green light to become a half million according to yg
1, USER_MENTION some dudes from ndenderu won a green card and went to the states colorado after the first week they decided to
1, USER_MENTION a vivid sheen on these handmade genuine emerald green seaglass sterling silver earrings URL
1, USER_MENTION hot100 depends on things radio and streams we cant do anything about radio but requesting but we can control our streams
1, USER_MENTION a.j green on joe burrows composure during final drive the way he handled himself in that last drive was
1, USER_MENTION the green party was thrown off the wi ballot today mainly because they were too fcking stupid to hand in the proper
1, USER_MENTION thank you to USER_MENTION and USER_MENTION for the amazing green screens wether sitting at a desk or playing in vr this
1, USER_MENTION how does a team full of dogs kawhi pat bev pg morris trez lou jamychal green keep giving up these ginormous
1, USER_MENTION la joie incroyable et sur le discours roman du fabcaro partir du
1, USER_MENTION four western pennsylvania counties butler green fayette and washington filed a lawsuit claiming that governor tom
1, USER_MENTION what do you think is the real motivation of liberals democrats the un with china in tow in pushing a variant of
1, USER_MENTION new jersey man jason gelinas is identified as the developer behind a popular qanon website URL via USER_MENTION
1, USER_MENTION breaking in a decision the wisconsin supreme court rules the green party will not be added to the november ballot
1, USER_MENTION breaking the state supreme court has denied the green partys request to place presidential candidate howie hawkins on
1, USER_MENTION me in the rear view when i pass a state trooper after slowing down from to URL
1, bengals wr tyler boyd on the late opi call on a.j green i dont think it was a good call
1, USER_MENTION this is misha green writer showrunner and producer of lovecraft country seeing a lot of give credit for
1, USER_MENTION go harder
1, bengals wr a.j green gives joe burrow high praise after nfl debut weve got a special one in joe more URL URL
1, USER_MENTION a.j green this team is going to be special
1, USER_MENTION american idiot green day URL
1, USER_MENTION dynamite is green buy if you can while we wait gap is very close and a top is possible URL
1, USER_MENTION no name repeats now imagine having enough victims to make a suit jacket and matching pants for a rb
1, USER_MENTION its freemapmonday retweet and follow us for a chance to win the map of bandelier national monument nm usgsstore
1, USER_MENTION tropical storms unprecedented fires devastate america my concern misrepresenting
1, USER_MENTION breaking the south dakota attorney general reported hitting a deer saturday night but had actually hit and killed a man
1, USER_MENTION so so you think you can tell heaven from hell blue skies from pain can you tell a green field from a cold steel rail
1, USER_MENTION when the cashier asks if i wanna donate to the troops URL
1, USER_MENTION lgbtq organizations have offered numerous times to meet with j.k rowling in a private setting to respectfully discuss
1, USER_MENTION the commission on presidential debates is run by lobbyists and the legacy parties a joe roganhosted debate would be
1, USER_MENTION another great newsom first air quality in california worse than hong kong and india newsom chose to listen to
1, USER_MENTION keep a green tree in your heart
1, USER_MENTION la primera imagen es de one piece green secret pieces y la segunda de one piece magazine vol se ve que en aquella
1, USER_MENTION you know what i think the green bone saga would make a pretty dope manga or graphic novel someone call me
1, USER_MENTION plan b liberal green ideologues will amp up the misleadingly named fuel label anyone opposed
1, USER_MENTION dear lord today bless the week ahead when storms arise bestow tranquility and peace that i may not be moved work
1, USER_MENTION sending positive thoughts next stop is rikers island once there as trump awaited transfer to a state prison the
1, USER_MENTION there are people in washington who say the green new deal is too expensive and we afford it what is the
1, USER_MENTION kevin durant claims his relationship with draymond green actually improved after their heated argument in a game in
1, USER_MENTION uae has given israel a green light to annex alaqsa mosque the third holiest site in islam it wont be long until
1, vikings fb c.j ham on kfan thing is we get to play again in a number of weeks and redeem
1, a.j green on offensive pass interference called on him for one he was clamping me the whole time coming off the ball within five yards so if are gonna call that we can call that both ways but they made the call and we lost the game bengals
1, USER_MENTION sign this petition to tell lawmakers to oppose all defund the police legislation URL we cant
1, USER_MENTION
1, USER_MENTION
1, USER_MENTION it is really hard to photograph a meteor even though some million of them hurtle toward earth each day most of them are
1, USER_MENTION to honor seokjin awake anniversary a green sea turtle sky was adopted under kim seokjin this donation will be
1, USER_MENTION a half million people in oregon evacuate as wildfires rage over million acres in california burned the western sky is
1, USER_MENTION on samedi soir au milieu et je me retrouve aider par des professionnelles
1, USER_MENTION week of in gemini what book is it that tells you of this love its not in there in the mirror you will paint
1, USER_MENTION joe burrow is warming up by throwing fades to a.j green tyler boyd tee higgins and john ross bengals
1, USER_MENTION a vote for the green party is a vote for fascism pass it on
1, good afternoon aj dillon had more rushing yards than saquon this weekend
1, USER_MENTION rookie rbs listed with team for week clyde edwardshelaire jk dobbins jonathan taylor cam akers
1, USER_MENTION so what does packers rookie running bacm aj dillon sound like in full URL
1, USER_MENTION if going to draft aj dillon as a power back maybe use him in power back situations
1, time to pound aj dillon what sam francisco would do run the ball
1, aj dillon in the house gbvsmin
1, aj dillon on fresh legs is getting this series he opens with yards and then lafleur hits vikings with an end around to tyler ervin packers
1, quarter with a lead bring in the closer aj dillon time
1, USER_MENTION if jordan love cant beat out tim boyle and aj dillon cant beat out jamaal williams what the hell were the packers
1, give me aj dillon
1, aj dillon running over nfl linebackers is a fantastic site to see thunderthighs
1, first impression of aj carry the man is huge gopackgo
1, should the packers have run aj dillon or josiah deguara on and
1, if going to draft aj dillon as a power back maybe use him in power back situations
1, a few players i am excited to watch today jonathon taylor chase young drew lock cam akers ceedee lamb sean murphy bunting jonnu smith aj dillon what about you
1, would you trade sammy watkins for the below players zack moss laviska shenault antonio gibson aj dillon if the answer is yes which it should be then try to move sammy for a because all of those players were round picks i would send an offer to every team
1, USER_MENTION cash machine remix in hour with dillon francis and grandson URL
1, i want aj dillon vs anthony barr first play of the game
1, USER_MENTION aj dillon runs for yards and tds in seasons at boston college crickets chirp aj dillon wears short
1, USER_MENTION aaronwanbissaka bruno fernandes phil jones nemanja matic and juan mata all back at the united training ground
1, USER_MENTION crazy that the packers selected a backup qb instead of ceh at a cost controlled versatile weapon for aaron
1, USER_MENTION first play of josiah deguaras nfl career and matt lafleur asks him to block one of the best lbs in the nfl aaron
1, USER_MENTION were gonna make sure that every one of those people goes on record and is held accountable for the illnesses of our
1, USER_MENTION black children were killed in birmingham on september johnny robinson and virgil ware in addition to addie mae
1, USER_MENTION it is important to be open to changing the terminology that ones uses in order to more precisely describe a
1, USER_MENTION does any program have a recent rb history as impressive as this spoiler alert nah USER_MENTION built his
1, USER_MENTION yeaah me just having fun doing what i iamlegend USER_MENTION brandon freaking phillips URL
1, USER_MENTION most missed tackles forced among wk1 rbs josh jacobs cmc ceh zeke kareem hunt
1, USER_MENTION lights are too bright for you get off the aaron jones URL
1, USER_MENTION extendar
1, USER_MENTION drew lock time URL
1, USER_MENTION aaron jones from the city of the URL
1, first play of josiah deguaras nfl career and matt lafleur asks him to block one of the best lbs in the nfl aaron jones didnt follow the block but thats a win for the rookie no wonder they love this kid URL
1, USER_MENTION aaron donald gets inside hand placement executes a over on the blocker dl all rbs should be treated like
1, USER_MENTION in week packers aaron jones scored fantasy points rb51 and finished rb2 browns nick chubb scored
1, USER_MENTION aaron jones URL
1, USER_MENTION aaron jones busted out the touchdown shades USER_MENTION USER_MENTION URL
1, why did packers aaron jones decide to put on those signature sunglasses following his first touchdown of the season USER_MENTION explains also his sombrero USER_MENTION sunglasses combo are here to stay URL
1, USER_MENTION aaron donald casts ezekiel elliot away with his off hand like a rag doll URL
1, USER_MENTION aaron jones is cooler than anyone has been or will ever be URL
1, USER_MENTION bro aaron donald wtf URL
1, lights are too bright for you get off the aaron jones URL
1, in week packers aaron jones scored fantasy points rb51 and finished rb2 browns nick chubb scored fantasy points rb24 and finished rb7 bengals joe mixon scored fantasy points rb59 and finished rb13
1, USER_MENTION aaron donald sending zeke to hell was so good i had to add some jim ross to it URL
1, USER_MENTION aaron jones back with the sombrero USER_MENTION via USER_MENTION URL
1, so yesterday was fun here are your full highlights notice how the packers offense attacked all areas of the field that was a point of emphasis all offseason p.s aaron jones real excited at the end URL
1, USER_MENTION joe rogan moderated presidential debates but it has elements of fear factor and other game shows alex jones is locked up in
1, USER_MENTION USER_MENTION is partnering with USER_MENTION for touchdowns for hunger URL each packers td
1, USER_MENTION previo al vikings vs packers aaron jones corredor de gb con un sombrero como homenaje a las fiestas
1, USER_MENTION start boston scott over lev bell chris carson nick chubb melvin gordon raheem mostert start over boston scott aaron
1, USER_MENTION aaron donald in week qb hurries qb hits sack a human cheat code URL
1, most missed tackles forced among wk1 rbs josh jacobs cmc ceh zeke kareem hunt cam akers boston scott aaron jones david johnson fantasyfootball
1, USER_MENTION aaron donald went full undertaker on zeke URL
1, USER_MENTION the list of rbs who have scored td with over yards per carry since aaron jones thats the list URL
1, USER_MENTION aaron jones is wearing sunglasses on the sideline as shade to anthony barr pay him all of the money
1, USER_MENTION cowboys ezekiel elliott is like pounds of muscle rams aaron donald is just tossing dudes around URL
1, USER_MENTION yahya abdulmateen ii sacha baron cohen joseph gordonlevitt michael keaton lead an allstar cast in the first
1, USER_MENTION qbs with best passer rating in week lamar jackson russell wilson gardner minshew aaron rodgers
1, USER_MENTION if aaron rodgers is your fedex air player of the week yards td int USER_MENTION
1, USER_MENTION clete blakeman who has an autographed poster of aaron rodgers in his room and a license plate that says gopackgo is
1, USER_MENTION aaron rodgers pff grade was the highest week grade by a qb since the aaron rodgers revenge tour is officially
1, USER_MENTION in a packers rookie chose an only child without many friends to be his bike kid at training camp giving him a
1, USER_MENTION aaron rodgers headlines pffs top performers from week URL
1, USER_MENTION aaron rodgers career vs lions pff grade tds ints bigtime throws next stop on the aaron rodgers revenge
