1, USER_MENTION USER_MENTION on the dolphins trying to snatch cam newtons chain short of spitting in a mans face this is the
1, USER_MENTION an up close shot of the scrum cam newton was involved in looks like one of the dolphins pulled his chain from his
1, USER_MENTION come play with cam newton
1, USER_MENTION mcdaniels called cam newton a complete player URL
1, USER_MENTION not only does cam newton take over for tom brady he will be the first starting qb for the patriots that was not drafted
1, USER_MENTION ok cam newton URL
1, USER_MENTION quick reminder that the patriots were the only team to offer cam newton a contract that was hard to understand then and
1, USER_MENTION gonna be a hell of a series but when will learn jimmy buckets and dem mf goons carry on
1, USER_MENTION qb rating in week josh allen cam newton sam darnold baker mayfield tom brady billsmafia URL
1, USER_MENTION with darius slaytons late score on mnf former auburn players turned in multiple touchdowns on nfl opening week
1, USER_MENTION allen robinson cam newton would create fireworks URL
1, USER_MENTION chris carson played just snaps yesterday carlos hyde played and travis homer played it wont
1, USER_MENTION trio of ohio state rbs were active in the nfl today j.k dobbins carlos hyde and zeke all found the end zone
1, chris carson played just snaps yesterday carlos hyde played and travis homer played it wont always be that even but the rotation in the seahawks backfield is very real
1, trio of ohio state rbs were active in the nfl today j.k dobbins carlos hyde and zeke all found the end zone
1, former ohio state running back carlos hyde scores his first touchdown as a seattle seahawk URL
1, touchdown seahawks carlos hyde from a yard out game over seattle
1, carlos hyde touchdown after a bit of comedy as will disly and greg olsen go in motion and run into each other seahawks
1, carlos hyde the td and i think everyone can rest easy
1, making sure miles is good is the right decision but damn carlos hyde been nice to have right about now
1, USER_MENTION pete carroll hints at going with the hot hand approach with chris carson and carlos hyde on sunday i think thats mostly
1, pete carroll hints at going with the hot hand approach with chris carson and carlos hyde on sunday i think thats mostly coach speak carson is the guy but i do think its a more even split than we saw last year
1, USER_MENTION wow this texans offense looks so different this season gotta wonder just how big the loss of carlos hyde is on their
1, USER_MENTION va la vacuna de la universidad rey juan carlos
1, wow this texans offense looks so different this season gotta wonder just how big the loss of carlos hyde is on their overall morale
1, USER_MENTION greg cosell on wentz missing reagor deep in the half the ball was correctly thrown to reagor but slowed
1, USER_MENTION most passing yards on throws yards downfield in week aaron rodgers carson wentz kirk
1, USER_MENTION for the love of all that is holy get carson outside the pocket v the rams URL
1, USER_MENTION USER_MENTION is putting all the blame on carson wentz for the eagles loss he was not good last year he has picked up
1, USER_MENTION carson wentz vs washington qbr by far worst in league dvoa by far worst in league bad throws
1, greg cosell on wentz missing reagor deep in the half the ball was correctly thrown to reagor but slowed down its a shame watching the game on tv you thought carson over threw it but watching the tape he didnt over throw it he actually made a perfect throw
1, USER_MENTION the eagles are in carson last starts at some point you unsee the reality of this
1, USER_MENTION highest rate of negatively graded pass plays in w1 carson wentz dwayne haskins mitchell trubisky jimmy garoppolo
1, USER_MENTION from the eagles have a lot of problems and carson wentz is the least of them URL
1, USER_MENTION it was at this moment carson wentz knew he was in for a long day photo credit to USER_MENTION URL
1, USER_MENTION aaron donald turns his worlddestroying sights on carson wentz URL
1, USER_MENTION yeah the eagles drafted a qb instead of packaging the pick to move up and take the best receiver in the draft because
1, USER_MENTION when carson wentz hears chase young coming URL
1, USER_MENTION jalen reagor said he could have played the ball on carson wentzs first int
1, USER_MENTION carson wentz dropping back against the washington football team defense URL
1, USER_MENTION carson wentz under pressure dropbacks most sacked times most URL
1, USER_MENTION aaron donald next week everytime carson wentz snaps the ball URL
1, USER_MENTION who would you rather have for big ben fav for carson wentz URL
1, USER_MENTION i think carson wentz and the fumbles that come from him trying to extend plays is like michael vick and how he never
1, USER_MENTION thinking about how carson wentz might actually die next good morning twitter URL
1, USER_MENTION carson wentz when he sees chase young lined up against his offensive line missing starters URL
1, USER_MENTION praying for carson wentz next week URL
1, USER_MENTION the eagles oline protecting carson wentz from the pass rush URL
1, USER_MENTION carson wentz after the other games he threw or more ints the next game he rebounded well and cleaned up mistakes
1, USER_MENTION jason peters to carson wentz i got
1, USER_MENTION am still the leader of the carson wentz train but yesterday i have a very real talk with him i expect a huge jump
1, most passing yards on throws yards downfield in week aaron rodgers carson wentz kirk cousins matt ryan URL
1, USER_MENTION lmao this makes it look like carson wentz is falling off the earth URL
1, USER_MENTION air yards per attempt leaders in week carson wentz tyrod taylor lamar jackson kirk cousins mitchell
1, USER_MENTION carson wentz on nonplayaction dropbacks pff passing grade lowest of any week qb URL
1, it was at this moment carson wentz knew he was in for a long day photo credit to USER_MENTION URL
1, USER_MENTION the eagles offensive line protecting carson wentz URL
1, highest rate of negatively graded pass plays in w1 carson wentz dwayne haskins mitchell trubisky jimmy garoppolo URL
1, USER_MENTION chase young spins inside off a chip block goes high on carson wentz but grabs his ankle turns degrees and jumps
1, USER_MENTION carson wentz after seeing he wasnt on the nfl top list URL
1, from the eagles have a lot of problems and carson wentz is the least of them URL
1, USER_MENTION the blame for this loss falls squarely on one persons shoulders URL
1, USER_MENTION the lowest pff passing grades from week jimmy g carson wentz sam darnold im not
1, USER_MENTION even imagine what the national media would already have to say about carson wentz if he threw for yards
1, carson wentz vs washington qbr by far worst in league dvoa by far worst in league bad throws most in league passing grade worst in league time to bounce back from one his career worst performances eagles URL
1, USER_MENTION carson wentz is hurting his team point blankhes hurting the team only reason wash is in game is wentz
1, USER_MENTION here are ceedee lambs catches in his debut with the cowboys URL
1, USER_MENTION most targets yards downfield without a dropped pass since ceedee lamb oklahoma nyqwan murray fsu
1, USER_MENTION cowboys draft pick ceedee lamb having any of his girl trying to check his phone URL
1, USER_MENTION the way ceedee lamb snatched that phone back nfldraft URL
1, USER_MENTION ceedee lamb honestly im not really too pleased with myself or my performance i feel like theres a lot more stuff
1, USER_MENTION ceedee lamb on gallups pi i didnt agree with the call
1, USER_MENTION ceedee lamb want his girlfriend to ceedee phone
1, USER_MENTION take it for what worth round wrs henry ruggs ceedee lamb01 jerry jeudy jalen reagor justin
1, USER_MENTION dak prescott ezekiel elliott and ceedee lamb give their thoughts after the loss in la to the rams URL
1, USER_MENTION jerry jeudy tonight receptions yards ceedee lamb yesterday receptions yards decent starts for the top
1, USER_MENTION the lamb in my name like URL
1, ceedee lamb in there getting grimy
1, USER_MENTION aldon smith ezekiel elliott dak prescott and ceedee lamb photos in the dallas week game notes URL
1, USER_MENTION ceedee lamb became the first rookie wide receiver to start a season opener for the USER_MENTION since terrance
1, take it for what worth round wrs henry ruggs ceedee lamb01 jerry jeudy jalen reagor justin jefferson01 brandon aiyuk tee higgins
1, USER_MENTION ceedee lamb and trevon diggs are going to be special i just need to get that off of my chest i know the l stinks
1, here are ceedee lambs catches in his debut with the cowboys URL
1, USER_MENTION this was a pretty weak blockintheback call on ceedee lamb too lots of tickytack calls in week from this crew
1, USER_MENTION ceedee lamb hauls in his first catch as a cowboy URL
1, the lamb in my name like URL
1, USER_MENTION the dallas cowboys confirmed several times that ceedee lamb was sixth on their board who do you think the top five were
1, USER_MENTION this is what elite qbing looks like slides his feet away from the pressure and delivers a strike to ceedee lamb
1, jerry jeudy tonight receptions yards ceedee lamb yesterday receptions yards decent starts for the top rookie wrs especially without any preseason future looks bright URL
1, USER_MENTION this was a pretty weak blockintheback call on ceedee lamb too lots of tickytack calls in week from this
1, jerry jeudy and ceedee lamb will be unquestionable stars shanny really better hope aiyuk becomes one too
1, USER_MENTION the cowboys drafted ceedee lamb but still wont ceedee playoffs
1, USER_MENTION rookie wr playtime leaders week dal ceedee lamb det quintez cephus lv bryan edwards min justin
1, USER_MENTION its almost as if ceedee lamb is a good punt returner and should be allowed to use that athleticism to help field position
1, USER_MENTION mane allat talk about ceedee lamb the nigga even c d
1, USER_MENTION rookie wr rd13 performances week justin jefferson jalen reagor bryan edwards henry ruggs
1, USER_MENTION rookie wr snap counts week dal ceedee lamb det quintez cephus lv bryan edwards lv henry ruggs
1, USER_MENTION rookie ceedee lamb with a punt return five yards longer than any cowboys punt return all of season
1, USER_MENTION ceedee lamb thought this was still the big lmao URL
1, USER_MENTION with cb trevon diggs wr ceedee lamb and t terence steele each making a start in game it marked the first
1, USER_MENTION dak prescott if for and td at the halfway point hes completed passes to different receivers ceedee
1, benny snell jerick mckinnon nyheim hines josh kelley chase edmonds james robinson zack moss were all top ff rbs in week URL
1, USER_MENTION chase edmonds sprints to the pylon for six azcardinals azvssf on fox nfl app yahoo sports app URL
1, USER_MENTION cardinals have never lost when chase edmonds scores a td
1, kingsbury said the chase edmonds touchdown catch was a play he stole from tennessee he said they scored on it too guess
1, chase edmonds sprints to the pylon for six azcardinals azvssf on fox nfl app yahoo sports app URL URL
1, cardinals have never lost when chase edmonds scores a td
1, kyler with a nice rollout pass to chase edmonds yards for a touchdown and just like that the azcardinals are back in it
1, USER_MENTION wild stephen gostkowski began game as the fifth most accurate fg kicker in nfl history barring
1, wild stephen gostkowski began game as the fifth most accurate fg kicker in nfl history barring another chance he will end it as the ninth most accurate being surpassed by dan bailey chris boswell and robbie gould
1, some wk1 rb snap counts todd gurley chris carson hyde devin singletary moss cmc dalvin cook burkhead white michel all jd mckissic gibson joe mixon ronald jones mccoy fournette
1, chris carson had just six carries vs the falcons pete carroll promises get more soon URL via USER_MENTION
1, USER_MENTION remember six years ago when everyone was writing tom brady off after a loss in september its happening again and
1, USER_MENTION joe douglass has been saving cash for who will be free agents in d.bakhitari chris godwin shaq barret
1, USER_MENTION USER_MENTION first completion with the USER_MENTION is yards to chris godwin gobucs tbvsno on fox nfl app yahoo
1, USER_MENTION wr chris godwin on his feelings after sundays game we realized we can use this as a teaching moment with the talent
1, USER_MENTION nfl week chris godwin USER_MENTION john reid USER_MENTION allen robinson ii USER_MENTION
1, USER_MENTION chris godwin on how tom brady was with the team after the game obviously been through a ton of football so he
1, USER_MENTION bucs wr chris godwin on the uncomfortable experience that ensued when he and his were pulled over by the
1, bucs wr chris godwin on the uncomfortable experience that ensued when he and his were pulled over by the police URL
1, remember six years ago when everyone was writing tom brady off after a loss in september its happening again and it probably shouldnt be URL
1, chris godwin on how tom brady was with the team after the game obviously been through a ton of football so he recognizes that just one week like i said the more we work together the better be going to fix these little things going to be
1, nfl week chris godwin USER_MENTION john reid USER_MENTION allen robinson ii USER_MENTION troy apke USER_MENTION release URL madeinhappyvalley weare URL
1, wr chris godwin on his feelings after sundays game we realized we can use this as a teaching moment with the talent we have in the locker room if we can correct the mistakes we made well be fine
1, wr chris godwin said after looking at the tape there were a handful of miscommunications offensively on sunday but hes not too worried about them honestly i think all of it is correctable
1, USER_MENTION i hate to go all godwins law but you know what other political party was loudly against abortion while at the same
1, joe douglass has been saving cash for who will be free agents in d.bakhitari chris godwin shaq barret allen robinson juju kupp shaqil griffin brandon schreff joe thuney a good year to have when nobody else does nfl jets nflnews round picks
1, USER_MENTION damn good tackle by chris godwin those guys have practice
1, USER_MENTION USER_MENTION URL URL
1, USER_MENTION chris godwin and emmanuel sanders have committed to do the first jersey swap of the year it will be sponsored by
1, USER_MENTION ceedy duce c.j gardnerjohnson has been everywhere filling gaps in run defense batting passes down guarding chris
1, USER_MENTION evans godwin gronk oj howard and tom favorite target thus far is URL
1, USER_MENTION bradys first completion as a buc is a dime to chris godwin USER_MENTION USER_MENTION USER_MENTION URL
1, ceedy duce c.j gardnerjohnson has been everywhere filling gaps in run defense batting passes down guarding chris godwin most of the game
1, USER_MENTION buccaneers fans after tom brady throws a yard completion to chris godwin URL
1, damn good tackle by chris godwin those guys have practice
1, tom first completion with the USER_MENTION goes to chris godwin URL
1, USER_MENTION sam weapons for the next three weeks jamison crowder breshad perriman chris hogan chris herndon ryan
1, sam weapons for the next three weeks jamison crowder breshad perriman chris hogan chris herndon ryan griffin frank gore kalen ballage josh adams
1, the only jets player that needs to be scooped off waivers is te chris herndon see believe achieve people
1, USER_MENTION chris herndon usage yesterday in very difficult matchup played snaps was slot or wide on of them
1, chris herndon usage yesterday in very difficult matchup played snaps was slot or wide on of them target share
1, jets stock report up s marcus maye definitely not bored cb bless austin tackled well p braden mann solid debut wr jamison crowder yac down qb sam darnold rusty without preseason cb pierre desir benched te chris herndon URL
1, quinnen williams and chris herndon needed to excel today from my eyes they did almost nothing jets
1, USER_MENTION i dont think he has a limit chris herndon on how good sam darnold can be this season URL
1, USER_MENTION harry styles is replacing shia labeouf in olivia worry the film also stars florence pugh
1, USER_MENTION USER_MENTION then work between the numbers and run the ball
1, USER_MENTION gase calls chris herndon a gamechanging type player nyj
1, USER_MENTION chris herndon was hurt then he wasnt then he was but now hes apparently fine tuesdays amiright anyway the man is
1, USER_MENTION how good can sam darnold be jets te chris herndon think a
1, USER_MENTION gase has mentioned chris herndon an awful lot today just said fired about getting him back said
1, adam gase on te chris herndon he is a gamechanging type player he can force a defense to change what chris is unique he can do a lot of stuff and pose a lot of problems
1, gase calls chris herndon a gamechanging type player nyj
1, gase loves him some chris herndon gamechanging type with the ability to force defenses to alter coverages jets
1, my fantasy team qb deshaun watson rb miles sanders rb derrick henry wr mike evans wr amari cooper wr marquise brown te chris eifert d steelers
1, chris herndon says he has a lot to prove to himself that back and better than i played only game last year jets URL
1, i dont think he has a limit chris herndon on how good sam darnold can be this season URL
1, jets te chris herndon on how good sam darnold can be think a nyj
1, how good can sam darnold be jets te chris herndon think a
1, USER_MENTION predictions herndon will be the te__ top dynasty wr in adp by the end of the season
1, gase has mentioned chris herndon an awful lot today just said fired about getting him back said people are about the guys the jets have last season
1, USER_MENTION god if youre listening i need sam darnold leveon bell and chris herndon to play all games along with our ol
1, USER_MENTION darnoldtoherndon touchdowntuesday takeflight URL
1, USER_MENTION basketball team lowkey has some scary potential shai gilgeousalexander jamal murray luguentz dort rj barrett
1, USER_MENTION the club were deeply saddened to hear of the passing of lifelong fan chris thompson yesterday he was an everpresent
1, the club were deeply saddened to hear of the passing of lifelong fan chris thompson yesterday he was an everpresent home and away and a friend of many of the staff at the valley and sparrows lane rip chris cafc URL
1, USER_MENTION klay thompson shot from three in the finals here are his made threes URL
1, USER_MENTION chris evans uses penis pic for get out the vote campaign URL
1, USER_MENTION charity walk acc chris johnson is on a mission to walk steps to support the motor neurone disease
1, USER_MENTION chris browns old music will forever be a vibe
1, USER_MENTION replacing her linford christie daley thompson chris akabusi colin jackson tessa sanderson just
1, USER_MENTION my current hero is hunter s thompson who pointed out all the way back in that the democratic party uses the
1, sad news today lifelong charlton fan chris thompson well known on the internet scene as dr.kish has passed away today condolences to chris and his family our prayers are with you at this awful time from everyone at fans for fans brett
1, shocked and saddened to hear the news that we have lost chris thompson of the dr kish blog i was texting with him only this morning ill miss our pregame chats on the low wall opposite the chippy in floyd rd rip ketts another member of the cafc family gone URL
1, sad news re cafc long life supporter chris thompson better known on the internet forums as dr kish who has sadly passed away rip chris
1, USER_MENTION klay thompson once said URL
1, USER_MENTION chris thompson
1, USER_MENTION new kit harington and tuppence middleton in burn by chris thompson for the popcorn writing award URL
1, USER_MENTION coming soon the wild life chris penn lea thompson eric stoltz ian mitchellsmith rick moranis randy
1, USER_MENTION klay thompsons shot looks even better than before his injury his dad says URL URL
1, replacing her linford christie daley thompson chris akabusi colin jackson tessa sanderson just bloody ridiculous she has been an absolute darling for years shameful URL
1, USER_MENTION awesome kit harington and tuppence middleton perform burn by chris thompson by popcorn group productions thanks for
1, bringing you closer to tonights action are USER_MENTION andy thompson USER_MENTION and michael kightly plus a season preview with USER_MENTION opposition view with leon clarke tune in from on youtube or the wolves app URL
1, USER_MENTION on a john thompson segment on the jump i mentioned belief in right to for black coaches i found a
1, USER_MENTION USER_MENTION URL URL
1, USER_MENTION true freshman chris thompson jr standing out in coveted auburn safety rotation URL
1, USER_MENTION the way charlie kirk and the rest of conservative inc talks about every voice and you would think the
1, USER_MENTION christian kirk was behind deandre hopkins in targets but only behind in air yards in week
1, christian kirk was behind deandre hopkins in targets but only behind in air yards in week
1, the way charlie kirk and the rest of conservative inc talks about every voice and you would think the lyrics are black power black separatism kill all the whiteys fuck da police literally a christian hymn
1, i need a government bailout package for christian kirk until kyler redistributes the wealth
1, USER_MENTION for the second straight season cardinals have three scottsdale saguaro high school products on the roster
1, USER_MENTION removing under god is the result of removing godjudeochristian morals from society the chaos violence in the
1, USER_MENTION christian kirk was inefficient last season and the cardinals added deandre hopkins to their team can kirk still breakout
1, USER_MENTION all christian denominations here have their own specific quirks and stereotypes protestantism has hiding toasters in
1, tyler boyd christian kirk and mike evans have a combined catches which seems bad and also not good
1, USER_MENTION freedom of religion christian not christian
1, be clear about a couple things the USER_MENTION is named for jerry falwell jr charlie kirk and the bad ideas those two men represent the USER_MENTION needs to shut down if USER_MENTION is going to have a serious future in christian higher education URL
1, USER_MENTION i am gay since i got involved in politics the kindest and most loving people have been trump supporters often
1, prediction christian kirk scores a touchdown tomorrow going to abuse the second and third corners
1, for the second straight season cardinals have three scottsdale saguaro high school products on the roster christian kirk byron murphy and d.j foster
1, former scottsdale saguaro hs football players on cardinals active roster dj foster christian kirk byron murphy might be only nfl team right now with players from same high school
1, christian kirk was inefficient last season and the cardinals added deandre hopkins to their team can kirk still breakout and be fantasy football relevant check out my latest article as i breakdown why i believe his breakout season is still coming link below
1, USER_MENTION highest share of team rb rushing attempts in week james robinson joe mixon christian mccaffrey
1, USER_MENTION highest share of total team touches in week josh jacobs derrick henry christian mccaffrey
1, USER_MENTION most broken tackles in week pff josh jacobs christian mccaffrey derrick henry clyde edwardshelaire
1, USER_MENTION hear from christian mccaffrey as he speaks to the media URL
1, USER_MENTION most rush yards in nfl wk clyde edwardshelaire ceh yards after contact christian mccaffrey
1, USER_MENTION a dude just traded patrick mahomes mike evans jk dobbins and hunter henry for christian mccaffrey in a longrunning
1, USER_MENTION johnathan abram is the raiders most important defensive player christian mccaffrey got the ball straight times abram
1, USER_MENTION christian mccaffrey is faster than forrest gump
1, USER_MENTION good morning the panthers could be today but we decided to run into a man box in tight formation with one of the
1, most broken tackles in week pff josh jacobs christian mccaffrey derrick henry clyde edwardshelaire ezekiel elliott melvin gordon kareem hunt
1, highest share of total team touches in week josh jacobs derrick henry christian mccaffrey clyde edwardshelaire URL
1, USER_MENTION christian mccaffrey says he congratulated ron rivera on his first win with washington says he plans to shoot cam a
1, a dude just traded patrick mahomes mike evans jk dobbins and hunter henry for christian mccaffrey in a longrunning dynasty league wow
1, USER_MENTION most broken tackles as a runner and receiver since kareem hunt christian mccaffrey alvin kamara
1, USER_MENTION panthers rb snap counts week christian mccaffrey mike davis new coaching staff same story
1, cuantas veces le van a dar el a kevin henry lleva toques entre carreras y recepciones en menos de medio partido ayer christian mccaffrey lo veces y alvin kamara sumando en ambos carreras y recepciones titans nfl
1, USER_MENTION hoodie giveaway squad pick christian mccaffrey to score a td giving away hoodies to followers
1, USER_MENTION christian mccaffrey td our first pick from squad show hits and giving away hoodies this
1, USER_MENTION who does better in week christian mccaffrey or saquon barkley
1, trying to draw the lines between ceh catching passes in college from joe burrow burrow only targeting mixon once in week joe brady calling an target share for christian mccaffrey ceh being targeted times in his nfl debut how does it make sense URL
1, christian mccaffrey said he texted ron rivera congrats on his win he added he will also text cam the same said he wants to see his friends do well
