1, USER_MENTION all the analysts getting ready to put down josh allen for another season URL
1, USER_MENTION the nfl media after josh allen rushes for td throws for yards tds and has a completion percentage URL
1, USER_MENTION who thought that lamar jackson and josh allen would be the only successful qbs from the class
1, USER_MENTION bills josh allen had the highest completion yesterday but that one throw to brown is all see billsmafia
1, USER_MENTION josh allen completed passes intended for stefon diggs pretty damn accurate if you ask me
1, USER_MENTION josh allen threw for a careerhigh yards and two touchdowns on sunday completing percent of his passes twitter
1, USER_MENTION apparently your allowed to do this if your name isnt josh allen thats the nfl mvp trying to make a play for his team
1, colin cowherd on his show today think buffalo has figured it out they like josh allen but not lead by josh allen accounted for of the bills offensive yardage on sunday as well as scoring all three of their touchdowns watch the games
1, USER_MENTION interesting note from week the bills led the nfl by a decent gap with of their plays being play action last
1, USER_MENTION stefon diggs says he was impressed with josh allens poise in his first game playing with his new quarterback bills
1, best week qb matchups josh allen vs mia allowed fantasy ppg to qb since dak prescott vs atl allowed fantasy ppg to qb since mitch trubisky vs nyg allowed fantasy ppg to qb since
1, USER_MENTION wow USER_MENTION did a full on USER_MENTION this morning i think joe burrow is a better prospect than sam darnold
1, USER_MENTION qb rating in week josh allen cam newton sam darnold baker mayfield tom brady billsmafia URL
1, i appreciate the talent that comes through lexington enough just in my four years at uk booker towns bam murray fox not to mention josh allen lynn bowden and benny snell oh yeah a million mlb picks and sydney mclaughlin just wild
1, USER_MENTION look familiar looks like something josh allen did yesterday but he was crucified for it the josh allen hate is so crazy
1, USER_MENTION josh allen making a mistake is like your dog peeing on the rug hard to stay mad at him for long
1, USER_MENTION josh jacobs USER_MENTION has tallied his fourth multirush td game in just his first career contests tied for
1, USER_MENTION highest share of team rb rushing attempts in week james robinson joe mixon christian mccaffrey
1, USER_MENTION going through the raiders week tape rb josh jacobs total yards tds can see the receiving traits here
1, USER_MENTION highest share of total team touches in week josh jacobs derrick henry christian mccaffrey
1, USER_MENTION raidernation make sure you vote for josh jacobs for fedex ground player of the week
1, USER_MENTION most rushing yards by a raiders rb through his first career games josh jacobs marcus allen
1, USER_MENTION after all the jonathan taylor talk maybe this will help show where my at running backs take over
1, USER_MENTION most broken tackles in week pff josh jacobs christian mccaffrey derrick henry clyde edwardshelaire
1, USER_MENTION young rbs watch josh jacobs on this how you earn the trust of your qb and coaches to stay on the field for
1, USER_MENTION back turning heads vote USER_MENTION for USER_MENTION ground nfl player of the week URL URL
1, USER_MENTION rbs that played snaps week pff EMO_NEG cmc saquon barkley zeke david johnson josh jacobs
1, USER_MENTION josh jacobs forced missed tackles on sunday most of any running back in week and thats more than the next rb
1, USER_MENTION let a chiefs player beat josh jacobs on this poll vote now
1, USER_MENTION let a chiefs player beat josh jacobs on this poll vote now URL
1, USER_MENTION raidernation make sure you vote for josh jacobs for fedex ground player of the week URL
1, USER_MENTION josh jacobs is shakin defenders USER_MENTION raidernation lvvscar on cbs nfl app yahoo sports app URL
1, USER_MENTION loaded USER_MENTION nfl week reaction show USER_MENTION USER_MENTION discussing everything you need to know
1, USER_MENTION josh jacobs pass protection looking to raidernation URL
1, takeaways teddy looks really good and comfortable in that offense he moves so well in the pocket josh jacobs is elite rb2 robby anderson took damon arnette to school on a double move for a huge td these teams are basically the same team all o no d
1, USER_MENTION josh jacobs USER_MENTION has tallied his fourth multirush td game in just his first career contests tied for
1, young rbs watch josh jacobs on this how you earn the trust of your qb and coaches to stay on the field for downs raiders URL
1, USER_MENTION most rushing yards after contact in w1 clyde edwardshelaire josh jacobs which rb would you rather have ros
1, USER_MENTION breaking down the w on upon further review listen URL URL
1, after all the jonathan taylor talk maybe this will help show where my at running backs take over jonathan taylor right now in seasonlong fantasy football cmc saquon zeke kamara cook henry ceh maybe josh jacobs maybe miles sanders it play to win
1, josh jacobs raidernation URL
1, josh jacobs hit the end zone three times and earned that snickers chain USER_MENTION USER_MENTION URL
1, USER_MENTION when i spoke to katie jacobs who is on the board of vivendi we decided to create a for the music industry
1, let a chiefs player beat josh jacobs on this poll vote now URL
1, USER_MENTION would you rank josh jacobs among rbs in the URL
1, USER_MENTION josh jacobs after not winning oroy URL
1, USER_MENTION josh jacobs rushed for yards after contact in sundays win per USER_MENTION totaling yards on the ground that means
1, USER_MENTION most missed tackles forced among wk1 rbs josh jacobs cmc ceh zeke kareem hunt
1, USER_MENTION highest rushing grade among rbs on and short since chris carson josh jacobs devonta freeman
1, most rushing yards after contact in w1 clyde edwardshelaire josh jacobs which rb would you rather have ros in fantasy
1, USER_MENTION yesterday was so special josh jacobs dad and family came out to watch the game with my booster club seeing them so
1, raidernation make sure you vote for josh jacobs for fedex ground player of the week URL
1, most broken tackles in week pff josh jacobs christian mccaffrey derrick henry clyde edwardshelaire ezekiel elliott melvin gordon kareem hunt
1, this stat shows just how great josh jacobs was in the raiders week win over the panthers URL URL
1, USER_MENTION it is steelers gameday were giving away a signed custom juju smithschuster jersey away to celebrate to enter
1, USER_MENTION juju smithschuster and james washington finished with three combined touchdowns last night but juju target share
1, USER_MENTION lets have some fun jets fans wide receiving corps juju smithschuster jamarr chase jamison crowder
1, USER_MENTION juju smithschuster was spotted buying a meal for someone in need via USER_MENTION URL
1, USER_MENTION let juju two touchdowns distract you from the fact that diontae johnson led pittsburgh with
1, USER_MENTION nfl star doesnt know hes being filmed when he pulls off an incredible act of kindness the video will warm your heart
1, USER_MENTION that was ben first touchdown in days last touchdown came on december which was
1, USER_MENTION juju smithschuster said he told diontae johnson after the twominute drive thats ben thats what we do
1, USER_MENTION juju smithschuster tonight targets receptions yards touchdowns key fumble recovery juju
1, this is the most underrated play from yesterdays game big run for benny snell but he fumbles and the steelers keep the ball thanks a gamechanging heads up recovery by juju smithschuster juju was fantastic yesterday URL
1, USER_MENTION this is who juju smithschuster is not just when he knows being recorded make this guy a steeler for life
1, USER_MENTION the giants call for juju smithschuster going in motion is cereal that just sounds like good marketing for juju
1, tuesday september and juju smithschuster is wr1 material
1, juju smithschuster big ben fantasy gold URL
1, USER_MENTION wed like to say thank you to our loyal fans for their support throughout the year retweet for your chance to win this
1, USER_MENTION ben being healthy is huge for juju smith schuster two tds tonight and remember in a contract year i
1, lets have some fun jets fans wide receiving corps juju smithschuster jamarr chase jamison crowder denzel mims vyncint smith
1, USER_MENTION no tv cameras in sight juju smithschuster bought this man in need lunch respect URL
1, USER_MENTION pit drafted juju smithschuster picks after the eagles drafted sidney jones drafted j washington in the rd
1, USER_MENTION juju smithschuster had catches on targets for yards and two tds against the giants steelers
1, USER_MENTION juju smithschuster buys meal for man in need awesome video URL
1, USER_MENTION antonio brown martavis bryant juju smithschuster and james washington all scored touchdowns on their first ever touch in
1, thats juju he came in ready to play and he performed well i dont know if any of us were surprised by what he delivered last night coach tomlin on juju smithschuster
1, USER_MENTION juju smithschuster lined up considerably more often in the slot tonight against the giants than in week at
1, USER_MENTION juju smithschuster who wasonlygoodbecauseofantoniobrown has caught all six of his targets for yards and tds
1, USER_MENTION steelers sold out to stop the run they did giants had yards on carries for all the weapons ben
1, the giants call for juju smithschuster going in motion is cereal that just sounds like good marketing for juju URL
1, USER_MENTION were going to give away a juju smithschuster autographed jersey for a chance to win retweet this tweet
1, juju smithschuster and james washington finished with three combined touchdowns last night but juju target share washington target share diontae johnson target share
1, nfl star doesnt know hes being filmed when he pulls off an incredible act of kindness the video will warm your heart URL
1, USER_MENTION juju fkn smithschuster
1, USER_MENTION the steelers have weapons like juju smithschuster diontae johnson and chase claypool yet they keep feeding james
1, USER_MENTION with season opener hours away expectation is steelers arent extending many key free agents right now team
1, four patriots who were on the roster when malcolm butler made his glorious interception are currently on the patriots roster devin mccourty julian edelman james white matthewslater donta hightower patrick chung marcus cannon brandon bolden opted out of this season
1, USER_MENTION julian reaction to antonio brown signing URL
1, USER_MENTION this is the best thing see on this app all day courtesy of julian edelman starring cam newton and bill
1, USER_MENTION something looking forward to on sunday julian edelman and his elite footwork some of the best in the league
1, USER_MENTION julian edelman who is jewish responds to desean antisemitic ig posts he offers to go with jackson to
1, USER_MENTION one year ago today tom brady was the patriots quarterback antonio brown julian edelman and josh gordon were the
1, USER_MENTION patriotsnation this and reply letting us know where be watching game from to
1, USER_MENTION throwing picks josh allen is fumbling trying to do too much julian edelman is dropping easy completions
1, USER_MENTION hes a baller he brings energy made some incredible plays and were going to need that from him all year julian
1, USER_MENTION cam newton calls julian edelman
1, USER_MENTION julian edelman im happily miserable
1, USER_MENTION julian edelman with his trademark full sprint out of the tunnel but no fans to fire him up as he arrives at the end
1, USER_MENTION highest target share in week deandre hopkins davante adams jamison crowder julian
1, USER_MENTION official patriots offensive snaps ryan izzo unsung at te all but snap sixthround pick mike onwenu contributes
1, USER_MENTION julian edelman who played of the offensive snaps last season and led the team with receptions is opening todays
1, USER_MENTION julian hype video for game should get you excited URL
1, USER_MENTION with that reception julian edelman has career receptions with the patriots the patriots player in history to
1, USER_MENTION julian edelman on cam newton hes a stud
1, USER_MENTION pressbox announcement that reception for julian edelman the of his career second in franchise history
1, interesting nugget about julian edelmans usage yesterday he was only on the field for of run plays per USER_MENTION but was on the field for of cams dropbacks so basically the patriots gave him a breather on runs his usage in passing situations was the same as usual
1, USER_MENTION death taxes and julian edelman making unreal catches in between the numbers
1, USER_MENTION matthew slater with some extremely high praise for julian edelman i know that still playing in this league
1, USER_MENTION julian edelmans trash talk to the dolphins after newtons second td is not suitable for this family website
1, USER_MENTION congratulations to new england patriots wide receiver julian edelman he just made his reception of his career
1, highest target share in week deandre hopkins davante adams jamison crowder julian edelman amari cooper URL
1, USER_MENTION patriots skillposition snaps wrs nkeal harry damiere byrd julian edelman jakobi meyers tes ryan izzo
1, USER_MENTION cam newton to julian edelman this connection has steadily grown throughout camp have a feeling see a lot of this
1, official patriots offensive snaps ryan izzo unsung at te all but snap sixthround pick mike onwenu contributes as eligible te and backup right tackle wr julian edelman gets eased in behind harry and damiere byrd URL
1, USER_MENTION cam newtons first throw today was an incomplete deep pass cam newtons first throw today was an accurate deep throw
1, USER_MENTION listen to the lyrics here definitely shade toward brady and gronk love julian edelman
1, USER_MENTION julian edelman and harry getting in some early work URL
1, USER_MENTION new year old routine julian edelman out early for passcatching work URL
1, cam newtons first throw today was an incomplete deep pass cam newtons first throw today was an accurate deep throw dropped by julian edelman that carried the requisite velocity and arrived with good timing
1, USER_MENTION julian edelman and harry are on the field URL
1, USER_MENTION cam newton said thursday that he likes to tease julian edelman to get him to lighten up edelman said it doesnt work
1, patriots skillposition snaps wrs nkeal harry damiere byrd julian edelman jakobi meyers tes ryan izzo devin asiasi mike onwenu justin herron rb sony michel rex burkhead james white j.j taylor fb jakob johnson qb cam newton
1, USER_MENTION patriots skillposition snap counts through first quarter EMO_NEG rbs rex burkhead sony michel james white wrs
1, USER_MENTION three wr set antonio brown julian edelman josh gordon
1, USER_MENTION patriots skillposition snap counts halftime EMO_NEG wrs nkeal harry damiere byrd julian edelman jakobi meyers
1, USER_MENTION bill belichick said previously that it probably was the right thing to do to limit julian edelmans reps as a punt
1, USER_MENTION slater calls julian edelman the flying squirrel and says that he doesnt think hed still be playing if it wasnt for
1, USER_MENTION things are heating up between cam newton and julian edelman
1, correcto tom brady ya tiene su julian edelman en gobucs usa el jersey y se llama scott miller nfl
1, took us until left in the for scotty miller to get compared to julian edelman wes welker and danny amendola
1, hes a baller he brings energy made some incredible plays and were going to need that from him all year julian edelman on cam newtons debut with the USER_MENTION URL
1, julian edelman on cam newton hes a stud
1, USER_MENTION julio jones needs just catches to be the franchise alltime receptions leader atlvsdal sun fox URL
1, USER_MENTION wr stat lines in week julio jones rec yards deandre hopkins rec yards michael thomas rec
1, USER_MENTION falcons wr julio jones has played four career games against the cowboys here are his numbers in those four games
1, USER_MENTION new falcons wr russell gage had as many targets in week as julio jones and calvin ridley and he played through
1, USER_MENTION most games in nfl history with receiving yards and tds julio jones andre johnson jimmy smith
1, USER_MENTION friendly reminder that julio jones is still the best wr in the league URL
1, USER_MENTION matt ryan x todd gurley x julio jones the USER_MENTION have themselves quite the trio URL
1, USER_MENTION URL julio jones trip moonwalking
1, USER_MENTION calvin ridley is the sixth player to have receptions and receiving touchdowns within his first games
1, julio jones needs just catches to be the franchise alltime receptions leader atlvsdal sun fox URL
1, USER_MENTION grady jarrett and julio jones are honored once again USER_MENTION has been named to the pfwa allnfc team while USER_MENTION
1, USER_MENTION USER_MENTION julio jones posted the first game of his season yesterday and of his career no
1, USER_MENTION week air yards leaders pff julio jones calvin ridley
1, USER_MENTION ryan was certainly looking spreading the ball around to his top wrs today julio jones targets receptions
1, USER_MENTION top5 falcons pff offensive grades vs seahawks wr calvin ridley qb matt ryan wr julio jones
1, wr stat lines in week julio jones rec yards deandre hopkins rec yards michael thomas rec yards URL
1, USER_MENTION top how does davante adams deandre hopkins nelson agholor julio jones and the cry baby himself michael thomas feel about that
1, URL julio jones trip moonwalking
1, falcons wr julio jones has played four career games against the cowboys here are his numbers in those four games receptions for yards and tds
1, USER_MENTION catches yards downfield in week julio jones hollywood brown calvin ridley adam thielen URL
1, USER_MENTION falcons wrs today calvin ridley targets catches yards julio jones targets catches yards
1, USER_MENTION best wide receiver seasons of the decade per pff war antonio brown antonio brown deandre hopkins julio
1, USER_MENTION fewest games to reach receptions in nfl history antonio brown julio jones marvin harrison andre johnson
1, USER_MENTION matt ryan throws for yards and julio jones calvin ridley and russell gage all go over yards
1, USER_MENTION the falcons had three receivers go over yards in todays game julio jones calvin ridley tds
1, USER_MENTION julio jones says hello
1, week air yards leaders pff julio jones calvin ridley
1, USER_MENTION is just the julio jones
1, USER_MENTION we used to diss michael jackson the media made us call him crazy then they killed him
1, USER_MENTION the big ten is back ohio state football is back give us clemson give us bama natty season baby justin fields
1, USER_MENTION the chargers are bringing a group of running backs to work out including former panthers draft pick jordan scarlett
1, USER_MENTION week players of the week afc offense qb lamar jackson bal defense casey hayward lac st k daniel carlson lv
1, USER_MENTION week injuries were tracking marlon mack heel ir blake jarwin knee ir michael thomas ankle george
1, USER_MENTION michael jackson thrived in a time devoid of itunes youtube instagram etc most popular name after jesus christ our
1, USER_MENTION phil jackson was right about doc rivers blowing leads URL
1, the chargers are bringing a group of running backs to work out including former panthers draft pick jordan scarlett and brian herrien who was in camp with the browns per sources justin jackson left sundays game with a quad injury
1, USER_MENTION a minha maior entrevista desde michael oprah winfrey imagina ter anos e a oprah winfrey dizer
1, USER_MENTION spent my morning reading petitions against the indian removal act the argument that we judge figures
1, USER_MENTION there needs to be more attention for the broncos safety duo of kareem jackson and justin simmons one of the best in
1, USER_MENTION stephen jackson doing pull ups while smoking a blunt in nyc URL
1, justin simmons kareem jackson alexander johnson played all defensive snaps
1, week injuries were tracking marlon mack heel ir blake jarwin knee ir michael thomas ankle george kittle knee james conner ankle plindsay toe lev bell hammy dparker hammy gerald everett back njoku knee out justin jackson quad
1, there needs to be more attention for the broncos safety duo of kareem jackson and justin simmons one of the best in the league
1, USER_MENTION anos justin timberlake foi o maior destaque do vma recebeu o por sua videografia o jackson
1, USER_MENTION a reporter asked john harbaugh if he liked to see lamar jackson run out of bounds on the play below harbaugh
1, USER_MENTION phil jackson talking about doc rivers teams blowing leads in the quarter URL
1, USER_MENTION most games with td passes since lamar jackson drew brees patrick mahomes dak prescott but USER_MENTION
1, USER_MENTION highest passer rating under pressure in week lamar jackson mr unlimited patrick mahomes
1, a minha maior entrevista desde michael oprah winfrey imagina ter anos e a oprah winfrey dizer isso para somente o justin bieber consegue isso holy is coming URL
1, USER_MENTION remember when michael jackson dangled justin bieber out that window what was that about
1, USER_MENTION injury update justin jackson quad is out lacvscin
1, USER_MENTION ronnie stanley calais campbell lamar jackson marquise brown mark andrews mark ingram justin tucker marlon humphrey
1, USER_MENTION lamar jackson USER_MENTION threw touchdown passes posted a passer rating in the USER_MENTION victory today it marks his
1, USER_MENTION cam newton teddy bridgewater dwayne haskins lamar jackson patrick mahomes kyler murray dak prescott tyrod
1, injury update justin jackson quad is out lacvscin
1, USER_MENTION with his win today ravens qb lamar jackson is as a starter
1, USER_MENTION browns first half njoku great start hunt need more touches garrett is locked in
1, USER_MENTION janet disse anos depois que se arrepende de ter pedido desculpas porque ela tinha nada do que se desculpar o
1, USER_MENTION if you still doubt lamar jacksons accuracy URL
1, USER_MENTION justin jefferson URL
1, USER_MENTION take it for what worth round wrs henry ruggs ceedee lamb01 jerry jeudy jalen reagor justin
1, justin jefferson URL
1, take it for what worth round wrs henry ruggs ceedee lamb01 jerry jeudy jalen reagor justin jefferson01 brandon aiyuk tee higgins
1, justin jefferson didnt get on the field until halfway through the q and only played snaps catches for yds on targets but that final catch was a preview of things to come yard slant from the slot turnt up for yard gain more jj please
1, USER_MENTION they really drafted justin jefferson bum ass because he can dance nigga stinks
1, USER_MENTION rookie wr playtime leaders week dal ceedee lamb det quintez cephus lv bryan edwards min justin
1, USER_MENTION rookie wr rd13 performances week justin jefferson jalen reagor bryan edwards henry ruggs
1, USER_MENTION rookie wr snap counts week dal ceedee lamb det quintez cephus lv bryan edwards lv henry ruggs
1, USER_MENTION most receptions with a step or more of separation in justin jefferson lsu devin duvernay texas
1, guys who need to get double and even triple the snaps in week than they did in week yannick ngakoue justin jefferson jeff gladney guys who need to get their snaps cut in half mike hughes eddie yarbrough jalyn holmes
1, justin jefferson caught more passes yesterday than laquon treadwell did in his entire rookie year i guess we can look at that as a positive vikings
1, USER_MENTION shoulda drafted justin jefferson huh URL
1, USER_MENTION so far josiah deguara has had a significantly larger impact on this game than justin jefferson just sayin
1, rookie wr playtime leaders week dal ceedee lamb det quintez cephus lv bryan edwards min justin jefferson lv henry ruggs jax laviska shenault jr phi jalen reagor ind michael pittman buf gabriel davis lar van jefferson
1, rookie wr snap counts week dal ceedee lamb det quintez cephus lv bryan edwards lv henry ruggs buf gabriel davis phi jalen reagor ind michael pittman lar van jefferson min justin jefferson jax laviska shenault jr
1, rookie wr rd13 performances week justin jefferson jalen reagor bryan edwards henry ruggs laviska shenault michael pittman devin duvernay van jefferson ceedee lamb i fully expect broncos jerry jeudy to best these numbers
1, USER_MENTION a tropical storm watch has been posted for covington forrest franklin jefferson davis jones lamar lawrence
1, ezra cleveland being inactive justin jefferson having minimal impact deandre swift drops the game winner cole kmet over shadowed by jimmy graham vikings corners torched USER_MENTION is right rookies are usually bad and we need to not get bogged down by draft grades
1, USER_MENTION justin jefferson woke up feeling first not a top rookie
1, USER_MENTION injury updates lions cb justin coleman hamstring ruled out jets rb leveon bell hamstring is doubtful to
1, so far josiah deguara has had a significantly larger impact on this game than justin jefferson just sayin
1, they really drafted justin jefferson bum ass because he can dance nigga stinks
1, shoulda drafted justin jefferson huh URL
1, vikings offensive coordinator gary kubiak had said at the start of training camp that four wide receivers would play a lot and he would regard them as starters they are adam thielen bisi johnson justin jefferson and taeje sharpe with chad beebe the odd man out
1, first career nfl game for these vikings rookies wr justin jefferson wr k.j osborn wr dan chisena cb cam dantzler cb jeff gladney
1, USER_MENTION what like having justin tucker as your kicker ravensflock nfl URL
1, USER_MENTION chinese virologist whistleblower dr limeng yan tells tucker carlson that covid19 was created and deliberately
