1, USER_MENTION imagine being derrick henry and never watching your kicker make a field goal for the entirety of your college and
1, USER_MENTION derrick henry still impossible to take to the ground USER_MENTION USER_MENTION URL
1, USER_MENTION just three players rushed for over yards in week clyde edwardshelaire derrick henry benny snell
1, USER_MENTION derrick henry stood up at the line via USER_MENTION URL
1, USER_MENTION alabama stats from monday night football derrick henry carries yards jerry jeudy catches yards
1, USER_MENTION i see you essang bassey no fear attacking derrick henry broncos love for their cbs to play the run well champ bailey
1, derrick last games for for for for for for for for for for total tds that game run would have won the rushing title of last years
1, USER_MENTION rushers in week clyde edwardshelaire derrick henry benny snell jr
1, USER_MENTION the mask hc mike vrabel wore to denver said give the ball to derrick to which one
1, USER_MENTION derrick henry had rushing yards against the chiefs in the half of the afc championship seven
1, USER_MENTION derrick henry has rushing yards in his last games
1, USER_MENTION if derrick henry is putting up numbers like on a day like yesterday when he even close to his best
1, USER_MENTION i know derrick henry had a son URL
1, USER_MENTION mnf is back tonight kickoff2020 check out the USER_MENTION giveaway will saquon barkley or derrick henry have more
1, USER_MENTION checking to make sure he started derrick henry in fantasy tenvsden URL
1, USER_MENTION the titans are now alltime in games where derrick henry runs for at least yards henry didnt have a run
1, USER_MENTION derrick henry got stuffed via USER_MENTION URL
1, USER_MENTION all of the pussies kneeling will be labeled as heroes while derrick henry will be crucified for standing with his
1, USER_MENTION tennessee titans running back derrick henry sent a powerful message before the week game against the denver
1, USER_MENTION officially derrick henry weeks till alabama football URL
1, USER_MENTION according to pfr the chiefs pressured deshaun watson on percent of his dropbacks no other team created pressure
1, USER_MENTION your latest USER_MENTION stat most games with a pass rush td since josh allen dak prescott deshaun
1, USER_MENTION need some new texans threads here is your chance to win a libertywhiteout jersey autographed by deshaun watson USER_MENTION
1, USER_MENTION cam newton teddy bridgewater dwayne haskins lamar jackson patrick mahomes kyler murray dak prescott tyrod
1, USER_MENTION deshaun watson and patrick mahomes numbers are eerily similar USER_MENTION URL
1, USER_MENTION sources the texans and franchise qb deshaun watson have agreed to terms on a huge new extension worth over new
1, USER_MENTION deshaun watson in the pocket URL
1, USER_MENTION contract extensions over last few days jalen ramsey kareem hunt deandre hopkins
1, USER_MENTION cash over next three years patrick mahomes million deshaun watson million ryan tannehill million
1, USER_MENTION happy birthday deshaun watson games for passing yards pass ypg ypa
1, USER_MENTION passer rating mitch trubisky deshaun watson patrick mahomes
1, USER_MENTION deshaun watson is the truth USER_MENTION spent a long time editing this so all shares retweets likes are
1, USER_MENTION deshaun watson eyeing ab URL
1, need some new texans threads here is your chance to win a libertywhiteout jersey autographed by deshaun watson USER_MENTION wearetexans
1, USER_MENTION dak prescotts only under contract with cowboys through but ezekiel elliott cant imagine this team without his
1, according to pfr the chiefs pressured deshaun watson on percent of his dropbacks no other team created pressure more than percent of the snaps
1, USER_MENTION mitch trubisky has more touchdown passes in than patrick mahomes and deshaun watson URL
1, USER_MENTION a change is happening this is the first time i feel like i can say whatever i need to say and its going to spark a
1, USER_MENTION one point in the game i started telling people in the crowd to come deshaun watson breaks down the falcons
1, USER_MENTION top coups in houston sports history jeff bagwell for larry andersen gerrit cole trade tmac for steve
1, USER_MENTION will fuller usage last night routes run on deshaun watson dropbacks targets for a share of
1, USER_MENTION what you investing your first million deshaun watson to patrick mahomes probably URL
1, USER_MENTION in week josh allen had a higher completion percentage than deshaun watson tom brady drew brees carson wentz
1, USER_MENTION deshaun watson after this game URL
1, USER_MENTION most yard completions outside the pocket last two seasons russell wilson patrick mahomes deshaun watson
1, cash over next three years patrick mahomes million deshaun watson million ryan tannehill million
1, USER_MENTION zack moss had three carries inside the fiveyard line in his first nfl game devin singletary has two carries
1, some wk1 rb snap counts todd gurley chris carson hyde devin singletary moss cmc dalvin cook burkhead white michel all jd mckissic gibson joe mixon ronald jones mccoy fournette
1, zack moss had three carries inside the fiveyard line in his first nfl game devin singletary has two carries inside the fiveyard line in his career while singletary outsnapped moss it could be moss who is more valuable in fantasyfootball bills billsmafia
1, its a micd up motor watch enjoy bills fans URL URL
1, USER_MENTION singletary did stabilize the individual on the ground while doing so he did stop breathing the mayor
1, most targets in week rbs EMO_NEG nyheim hines alvin kamara devin singletary URL
1, game stats josh allen yards tds rushing yards td fumbles devin singletary carries yards stefon diggs receptions yards john brown receptions yards td matt milano tackles int
1, USER_MENTION this devin singletary hesi was clean via USER_MENTION URL
1, USER_MENTION the bills are paying devin singletary and zack moss a total of over the next three years maybe some day
1, USER_MENTION without frank gore to follow around this bills training camp devin singletary has spent a lot of time with the jugs
1, USER_MENTION in adding zack moss to devin singletary the bills have a really fun and promising pair of players in their backfield
1, seeing these rb extension deals and then seeing devin singletary plus zack combined cap hit together billsmafia URL
1, the bills are paying devin singletary and zack moss a total of over the next three years maybe some day have to make a decision on having to pay one or the other a huge contract but for the next few years this is a great financial model for cap flexibility
1, in adding zack moss to devin singletary the bills have a really fun and promising pair of players in their backfield URL
1, ceh just had more goalline carries in one drive than devin singletary had all of last season
1, USER_MENTION juju smithschuster and james washington finished with three combined touchdowns last night but juju target share
1, USER_MENTION let juju two touchdowns distract you from the fact that diontae johnson led pittsburgh with
1, USER_MENTION juju smithschuster said he told diontae johnson after the twominute drive thats ben thats what we do
1, USER_MENTION diontae johnson among steelers week passcatchers of team targets snaps routes
1, USER_MENTION ryan switzer as soon as he heard diontae johnson fumbled URL
1, d.j moore allen robinson odell beckham t.y hilton a.j green diontae johnson mike williams all had at least targets fewer than ppr points expect to be higher on all of them than the consensus in week
1, USER_MENTION back to business shout out to the pittsburgh steelers wide reciever diontae johnson USER_MENTION big steppin
1, juju smithschuster and james washington finished with three combined touchdowns last night but juju target share washington target share diontae johnson target share
1, USER_MENTION the steelers have weapons like juju smithschuster diontae johnson and chase claypool yet they keep feeding james
1, USER_MENTION obviously diontae johnson was distracted by the crowd noise it is what it is
1, diontae johnson among steelers week passcatchers of team targets snaps routes run i dont care if he dropped a pass and made a couple mistakes neither did the steelers or ben roethlisberger
1, diontae johnson sees teamhigh targets in win URL
1, juju smithschuster said he told diontae johnson after the twominute drive thats ben thats what we do
1, underrated aspect of big bens game tonight diontae johnson looked overwhelmed early out of it ben kept going to him smart johnson is an important player for this offense dont let him lose confidence
1, diontae johnson after a rough first half had catches for yards in the second half URL
1, let juju two touchdowns distract you from the fact that diontae johnson led pittsburgh with targets and a target share
1, sure its too early to say but a.j brown terry mclaurin deebo samuel d.k metcalf darius slayton diontae johnson marquise brown and mecole hardman all look better than patriots firstrounder nkeal harry
1, USER_MENTION only good because of diontae johnson
1, week prices on USER_MENTION benny snell diontae johnson welcome to valuetown
1, you can see diontae johnsons confidence coming back
1, steelernation hear your thoughts on what you want to see in the second half whether an adjustment or something they need to continue doing ready for diontae johnson to redeem himself URL
1, me logging on to take a diontae johnson l after one half of football URL
1, USER_MENTION if the saints can win without drew brees they can win without mike thomas theyll be fine watch
1, USER_MENTION sept drew brees tears ligaments in right thumb sept reports that michael thomas ankle
1, USER_MENTION nfc south qbs pff after week matt ryan tom brady drew brees
1, USER_MENTION out at least three weeks the quarterbacks detroit will see the next three weeks aaron rodgers kyler murray drew brees
1, USER_MENTION if the saints defense plays the way it did in week during michael absence be just fine we saw
1, USER_MENTION espn on sunday morning tom brady and the bucs are going to be contenders from day look out saints espn on
1, USER_MENTION i saw a quarterback a head coach and an offensive system that hasnt been playing together the way that sean payton and
1, USER_MENTION one day you turn a blind eye to one guy kneeling for the anthem before you know it family man drew brees is running
1, USER_MENTION if you for some reason like drew brees you will now URL
1, USER_MENTION drew brees should probably retire URL
1, USER_MENTION drew brees and the saints knock out tom brady in week USER_MENTION URL
1, USER_MENTION tom brady will make his debut with the buccaneers squaring off against drew brees and the saints this will be the
1, USER_MENTION drew brees and tom brady have combined to throw touchdown passes in their careers more than nfl teams
1, USER_MENTION on this date in peyton manning threw for yards in a win over the giants in doing so he became the
1, USER_MENTION out at least three weeks the quarterbacks detroit will see the next three weeks aaron rodgers kyler murray drew brees
1, USER_MENTION if you stand with american patriot drew brees
1, USER_MENTION why is drew brees putting the name of criminal sexual assaulter jacob blake on his helmet
1, USER_MENTION sources saints believe qb drew brees has a shoulder injury that will likely cause him to miss games potentially several
1, USER_MENTION most games with td passes since lamar jackson drew brees patrick mahomes dak prescott but USER_MENTION
1, USER_MENTION patiently waiting for lebron and kapernick oh and drew brees denounce the senseless ambush of la sheriffs deputies
1, if the saints defense plays the way it did in week during michael absence be just fine we saw the defense rise to the challenge when drew brees was out last year
1, drew brees going to stretch a defense vertically much but still a precision passer last game change my mind on that a qb beat you on his back conversely he can with enough time in the pocket mike thomas or not raiders gotta bring
1, USER_MENTION drew brees has young children and is wearing a name on his helmet guess not down with veterans anymore
1, sept drew brees tears ligaments in right thumb sept reports that michael thomas ankle injury could sideline him for several games
1, USER_MENTION today was aaron rodgers career game with pass yards pass td and int that ties him for the
1, if the saints can win without drew brees they can win without mike thomas theyll be fine watch
1, USER_MENTION drew brees vs tom brady in URL
1, how did the saints score points on offense and yet it was maybe the worst game of drew brees career you could see the inaccurate throws from the broadcast but the a22 is revealing of deeper concerns not pulling the trigger with wide open receivers im inconsolable
1, USER_MENTION colts pass d still not getting it done highest completion allowed in franchise history drew brees
1, USER_MENTION USER_MENTION hey catturd i just tweeted to drew brees that once they catch the thug that shot the officers in la he
1, USER_MENTION gruden thought his young secondary did some good things but also made some critical mistakes that we have to clean up
1, USER_MENTION drew brees with a pretty good ending quote today at this time im on borrowed time ive got nothing to lose im
1, USER_MENTION so i sat down to see what was on tv and the nfblm was on cbs in the span of less than seconds i saw blm
1, USER_MENTION since derek carr has more yards per game than russell wilson more yards per attempt than aaron rodgers
1, USER_MENTION with passing td tonight ben roethlisberger becomes the qb in nfl history with at least touchdown passes in
1, USER_MENTION turnovers penalties no excuses totally but the bucs defense held drew brees to yards passing michael thomas
1, USER_MENTION bbc backlash beeb accused of bias as viewers blast newsnight host for supporting eu how many times will maitlis
1, USER_MENTION magic johnson on the clippers URL
1, USER_MENTION but doc rivers its time we had a talk bro jokic is looking like the greatest passing c of all time and you kept
1, USER_MENTION you dont need to be a supporter of boris johnson and the tories to recognise that this is entirely true URL
1, USER_MENTION the im bill is needed because the wa is a lousy deal there is not a single advantage for the uk in its pages
1, USER_MENTION texans rb duke johnson who sprained his ankle on thursday night is considered weektoweek and is a longshot to play
1, USER_MENTION kendrick nunn and james johnson wish jimmy butler a happy birthday URL
1, USER_MENTION dover the invasion continues boatloads of illegal migrants have crossed the channel to the uk already this
1, texans rb duke johnson who sprained his ankle on thursday night is considered weektoweek and is a longshot to play this week against the ravens source said however playing in week is possible an indication not a serious injury
1, USER_MENTION boris johnson is absolutely right to demonstrate that we are a sovereign nation and will do all that is necessary to
1, USER_MENTION knives out cinematography by steve yedlin directed by rian johnson read a delightful conversation with this
1, USER_MENTION rb duke johnson sprained his ankle during thursday loss to kansas city per source
1, USER_MENTION borisjohnson tony blair john major teaming up to form the dream team from hell to try stop boris johnson brexit bill
1, USER_MENTION sky news john major and tony blair tell boris johnson to drop his shameful brexit bill or be forced to by mps who
1, USER_MENTION boris johnson is preparing to opt out of major parts of european human rights laws risking an explosive new row with the
1, USER_MENTION boris johnson to opt out of major european human rights laws URL via USER_MENTION good i hope
1, USER_MENTION magic johnson calling kobe the greatest laker ever URL
1, USER_MENTION im really confused johnson sacked of his mps last year because they refused to vote for the wa now hes saying
1, USER_MENTION to claim that the eu is adopting an position of trying to divide the united kingdom is outrageously dishonest
1, USER_MENTION johnson accuses eu of trying to bring in a blockade in the irish sea URL via USER_MENTION
1, USER_MENTION bleep thankyou mr lammy you passed on questions and answered just one.the prime minister that sold off our
1, USER_MENTION from last night chiefs rb clyde rush yards are most by any player in his debut since kareem hunt
1, rb duke johnson sprained his ankle during thursday loss to kansas city per source availability for next game sunday sept against the ravens is now in question
1, USER_MENTION ernie johnson you get jamal murray open looks if charles barkley the utah
1, USER_MENTION who jon scheyer has brought to duke paolo banchero zion williamson jayson tatum jalen johnson aj griffin
1, USER_MENTION bill obrien staying committed to running it up the middle with duke johnson down in the second half whoever the texans
1, takeaways most to least important fuller target hog david johnson old self ceh for real coach gl patience watkins still kickin yuck watson hou ol kelly playcalling duke cobb cooks droppable soon hardman buried for now akins needs more targets
1, USER_MENTION chiefs and texans snaps pff clyde edwardshelaire darrel williams mecole hardman demarcus robinson
1, USER_MENTION texans injury update rb duke johnson is questionable to return with a leg injury houvskc
1, USER_MENTION texans injury update rb duke johnson has been downgraded to out with a leg injury and will not return houvskc
1, USER_MENTION texans rb duke johnson has now been ruled out for the rest of game with a leg injury
1, USER_MENTION fun way to memorize the johnson and johnson backfield if hes thirty one thats a david run if its a twenty five juke
1, USER_MENTION rest of the offense has to step up deonte harris emmanuel sanders smith calloway fowler cook trautman
1, USER_MENTION say hello to emmanuel sanders
1, USER_MENTION emmanuel sanders since targets catches drops URL
1, emmanuel sanders lead the nfl this last sunday with red zone targets raiders allowed the most yards to wrs in week and the most fantasy points youll see this stat again in this weeks lovehate URL
1, the paid a significant price for emmanuel sanders last season but they did just get mohamed sanu for much cheaper than the patriots did in new england had to use a secondround pick signing qualifies for the bargain bin
1, one of the biggest aspects mohamed sanu will bring to the is veteran leadership a major quality missing since emmanuel sanders left in free agency this offseason URL
1, emmanuel sanders since targets catches drops URL
1, USER_MENTION emmanuel sanders spitting facts to the wrs URL
1, say hello to emmanuel sanders
1, rest of the offense has to step up deonte harris emmanuel sanders smith calloway fowler cook trautman kamara montgomery
1, USER_MENTION need to trade for emmanuel sanders
1, USER_MENTION emmanuel sanders view of the locker room celebration after the saints seasonopening win video via USER_MENTION
1, USER_MENTION emmanuel sanders became the different player to catch a touchdown pass from drew brees
1, missing emmanuel sanders like crazy right now URL
1, USER_MENTION emmanuel sanders slips a tackle and finds the end zone saints USER_MENTION tbvsno on fox nfl app yahoo sports app
1, USER_MENTION emmanuel sanders with the touchdown welcome to new orleans
1, i really wish we had kept emmanuel sanders i know there were reasons circumstances price was too high blah blah just wish we could have made something work to keep him he was such a good fit for our team everyone loved him he brought vet experience
1, USER_MENTION emmanuel sanders has only played snaps trequan smith running as the no wr
1, USER_MENTION emmanuel sanders welcome to nola
1, USER_MENTION emmanuel sanders has now caught touchdowns from future hall of famers drew brees peyton manning ben
1, USER_MENTION emmanuel sanders ducks the high tackle attempt and gets in the end zone a very needed td saints had been
1, USER_MENTION the steelers used eric ebron essntially as a decoy almost all game the giants were worried about him because it seemed
1, USER_MENTION the steelers are holding a sign that says steelers against racism during the national anthem eric ebron among those holding
1, eric ebron gave it a good effort in his blocking doesnt even really outright win his reps but what he does well is try hard enough to lose slowly in this league that is all you can ask of a receiving first tight end like ebron i loved his effort and motor in the trenches URL
1, the steelers used eric ebron essntially as a decoy almost all game the giants were worried about him because it seemed like two defenders were on him a lot opened up stuff for other receivers ebron get a ton of production but he made a difference when on the field
1, USER_MENTION true but at least the lions got eric ebron
1, USER_MENTION true but at least the lions got eric ebron URL
1, USER_MENTION this steelers fan said that eric ebron is the best tight end in the afc north so i had to roast him again for another
1, the last things lions fans need tonight would be watching eric ebron catch a td
1, eric ebron for a big first down
1, steelers holding a sign that said against looked like both eric ebron and rookie chase claypool who so openly shared his fear for him raised a fist during the national anthem URL
1, the sign says steelers against racism looked from up here like no steelers no kneeled eric ebron and chase claypool raised fists
1, the steelers are holding a sign that says steelers against racism during the national anthem eric ebron among those holding a fist up URL
1, true but at least the lions got eric ebron URL
1, eric ebron on ig steelers URL
1, USER_MENTION remember when the detroit lions drafted eric ebron over aaron donald hahahahahahahahaha
1, really looking forward to seeing eric ebron with ben roethlisberger on monday steelers URL
1, USER_MENTION some things the steelers have said try more on offense this year more motion misdirection and play
1, if the steelers run wr sets with eric ebron in essentially a wr set same thing out of empty said this before ebron is virtually another wide receiver in this offense the wide reciever not listed a whole new mismatch weapon this team have
1, USER_MENTION yikes pff had evan engram graded as the worst of eligible tes in week giants
1, USER_MENTION evan engram earned the worst grade amongst tight ends in the nfl in week one according to USER_MENTION with an overall
1, USER_MENTION routes dropbacks travis kelce darren waller evan engram mark andrews
1, kaden smith needs to be sharing equal reps with evan engram after his performance last night not only is he a solid blocker in comparison but hes good in the passing game and can pick up chunks of yards to shorten down conversions we saw way too many and longs
1, USER_MENTION evan engram was a total disaster tonight biggest disappointment by far for the giants in week
1, USER_MENTION worst player on the field tonight is a way tie between nick gates cam fleming and evan engram
1, yikes pff had evan engram graded as the worst of eligible tes in week giants
1, USER_MENTION jason garrett please catch a ball evan engram URL
1, i remember these reps by evan engram against oshane ximines during training camp i thought it was a bit concerning at the time the giants te did not fair any better against bud dupree last night URL
1, routes dropbacks travis kelce darren waller evan engram mark andrews logan thomas hunter henry george kittle hayden hurst jordan akins mike gesicki jimmy graham zach ertz
1, i want to see saquon barkley and dion lewis on the field at the same time creat confusion and open up the screen game for evan engram we see it all the time with the chiefs have to keep defenses guessing togetherblue
1, USER_MENTION the evan engram we wanted vs the evan engram we got URL
1, evan engram earned the worst grade amongst tight ends in the nfl in week one according to USER_MENTION with an overall grade of on offensive snaps a night like to forget needs to bounce back against chicago giants togetherblue
1, USER_MENTION im fine with them calling that evan engram catch opi but only if theyre going to call the chase claypool catch opi
1, evan engram for allen robinson straight up i know the bears love tight ends and engram will be in chicago on sunday anyway get it done gettlefinger URL
1, evan engram was not so evan engram will have a good
1, USER_MENTION evan engram having a rough half giants
1, USER_MENTION final giants vs steelers evan engram cam fleming daniel jones jabril peppers
1, USER_MENTION evan engram forgot his hands and his brain today
1, USER_MENTION evan engram is pumped for USER_MENTION nflrebels URL
1, evan engram was a total disaster tonight biggest disappointment by far for the giants in week
1, final giants vs steelers evan engram cam fleming daniel jones jabril peppers joe judge giants ko coverage togetherblue nfl
1, worst player on the field tonight is a way tie between nick gates cam fleming and evan engram
1, USER_MENTION nfl week review chase young sack forced fumbles ezekiel elliott total yards tds jk dobbins tds
1, USER_MENTION ezekiel elliott scored on this play URL
1, USER_MENTION highest share of team rb rushing attempts in week james robinson joe mixon christian mccaffrey
1, USER_MENTION cowboys ezekiel elliott is like pounds of muscle rams aaron donald is just tossing dudes around URL
1, USER_MENTION most broken tackles in week pff josh jacobs christian mccaffrey derrick henry clyde edwardshelaire
1, USER_MENTION homer simpson did ezekiel elliotts feed me tattoo before zeke URL
1, USER_MENTION dak prescott ezekiel elliott and ceedee lamb give their thoughts after the loss in la to the rams URL
